{
  "version": "cogs.stage5-operations-runbook-index/v1",
  "authority": "local-static-draft-documentation-only",
  "issue": 366,
  "draft": true,
  "qualified": false,
  "campaign_authorized": false,
  "cloud_execution_observed": false,
  "provider_truth_observed": false,
  "operations_evidence_observed": false,
  "stage4_exit_satisfied": false,
  "release_eligible": false,
  "production_ready": false,
  "general_availability": false,
  "compliance_certified": false,
  "go_no_go": "not-available",
  "subscription_oauth": {
    "status": "disabled-unadvertised",
    "deferred_issue": 13,
    "future_post_mvp_only": true,
    "worker_refresh_tokens": "forbidden"
  },
  "policy_documents": [
    {
      "id": "runbook-policy",
      "path": "docs/operations/runbooks/README.md",
      "title": "Stage 5 draft operations runbooks",
      "content_sha256": "4f536e6ee7ef0b688e8d8bd2e27c536ff91a625f0fcdf719a3e46f4fb47bd197",
      "status": "policy-local-static-only"
    }
  ],
  "fact_classes": [
    {
      "id": "assumptions",
      "heading": "Assumptions",
      "authority": "untested-proposal-only",
      "can_satisfy_gate": false
    },
    {
      "id": "static-contract-facts",
      "heading": "Static contract facts",
      "authority": "local-static-shape-only",
      "can_satisfy_gate": false
    },
    {
      "id": "authoritative-local-facts",
      "heading": "Authoritative-local facts",
      "authority": "accepted-linux-kvm-applicability-only",
      "can_satisfy_gate": false
    },
    {
      "id": "future-cloud-evidence",
      "heading": "Future cloud evidence",
      "authority": "required-future-unexecuted",
      "can_satisfy_gate": false
    }
  ],
  "runbooks": [
    {
      "id": "installation",
      "path": "docs/operations/runbooks/installation.md",
      "title": "Draft installation guide",
      "content_sha256": "3ec28401f1ec424018be5aa6a14c5583788cf7d8ffc2c831c5c35d3ef9dcf890",
      "status": "draft-local-static-only",
      "evidence_contract": "future-operations-reference-v1"
    },
    {
      "id": "prerequisites",
      "path": "docs/operations/runbooks/prerequisites.md",
      "title": "Draft prerequisites guide",
      "content_sha256": "fec3897607b02e708ff4c66f59934d8a4adb8f6d555487e3b75ffc45248b6ad6",
      "status": "draft-local-static-only",
      "evidence_contract": "future-operations-reference-v1"
    },
    {
      "id": "nic-configuration",
      "path": "docs/operations/runbooks/nic-configuration.md",
      "title": "Draft NIC configuration guide",
      "content_sha256": "0ea147d0506c4d3bbe9e6512f2caf6189e2409474ce652601fe7d0de16bb9fa8",
      "status": "draft-local-static-only",
      "evidence_contract": "future-operations-reference-v1"
    },
    {
      "id": "platform-matrix",
      "path": "docs/operations/runbooks/platform-matrix.md",
      "title": "Draft NIC and platform matrix",
      "content_sha256": "6ef306b4fab0b27926c40ec049a26e8563afa7fa9a2fc41e25c065dacd3e649c",
      "status": "draft-local-static-only",
      "evidence_contract": "future-operations-reference-v1"
    },
    {
      "id": "upgrade",
      "path": "docs/operations/runbooks/upgrade.md",
      "title": "Draft runtime and proxy upgrade runbook",
      "content_sha256": "9c3bd0a063b959015de8eb8e44a41855c708b0ec34b38bf6484117cc1d6edcf9",
      "status": "draft-local-static-only",
      "evidence_contract": "future-operations-reference-v1"
    },
    {
      "id": "openbao",
      "path": "docs/operations/runbooks/openbao.md",
      "title": "Draft OpenBao policy and revocation runbook",
      "content_sha256": "a910c5cf13efae740fb698962ae078a5dc871e0d74f35d66a46e3a7e87a46ddb",
      "status": "draft-local-static-only",
      "evidence_contract": "future-operations-reference-v1"
    },
    {
      "id": "incident-response",
      "path": "docs/operations/runbooks/incident-response.md",
      "title": "Draft credential incident-response runbook",
      "content_sha256": "4e1890723490382eb44eb1330f00d4a9b140e3d3107b770516bd72e6782d563a",
      "status": "draft-local-static-only",
      "evidence_contract": "future-operations-reference-v1"
    },
    {
      "id": "cve-response",
      "path": "docs/operations/runbooks/cve-response.md",
      "title": "Draft node and runtime CVE response runbook",
      "content_sha256": "a6b64ba9a951a894056edf9d663373c630642c3a67c156ea98493f993c8417ff",
      "status": "draft-local-static-only",
      "evidence_contract": "future-operations-reference-v1"
    },
    {
      "id": "retention-deletion",
      "path": "docs/operations/runbooks/retention-deletion.md",
      "title": "Draft backup, retention, export, and deletion guide",
      "content_sha256": "d78fe24d32a19fb6c6c1a84893b824f275bd43a1ca28d18e989b35ef4e166365",
      "status": "draft-local-static-only",
      "evidence_contract": "future-operations-reference-v1"
    },
    {
      "id": "capacity",
      "path": "docs/operations/runbooks/capacity.md",
      "title": "Draft capacity and cost planning guide",
      "content_sha256": "1b0d76eb0d6ec438b71b166b7f2fbdc8a07e858643367fe04df47ec74978f918",
      "status": "draft-local-static-only",
      "evidence_contract": "future-operations-reference-v1"
    },
    {
      "id": "observability",
      "path": "docs/operations/runbooks/observability.md",
      "title": "Draft observability dashboard field reference",
      "content_sha256": "acf92d50717f6a37782c1ee080e7c5c3588fb5730513eee13718f84600876093",
      "status": "draft-local-static-only",
      "evidence_contract": "future-operations-reference-v1"
    },
    {
      "id": "limitations",
      "path": "docs/operations/runbooks/limitations.md",
      "title": "Draft known limitations and residual risks",
      "content_sha256": "56abec983b76fe0244751ad3c10b21ff1f89f672ee051e83ced975d09ca51cf7",
      "status": "draft-local-static-only",
      "evidence_contract": "future-operations-reference-v1"
    },
    {
      "id": "teardown",
      "path": "docs/operations/runbooks/teardown.md",
      "title": "Draft teardown and orphan-resource verification guide",
      "content_sha256": "f1804ada88c8d40e26c6305a9d5185596124c2dfadce1f36f3a1f8ae671b8a8c",
      "status": "draft-local-static-only",
      "evidence_contract": "future-operations-reference-v1"
    }
  ]
}
